{
  "schema_version": 3,
  "plan_fingerprint": "sha256:cbcaf0102a11fc20d056d9a3fdb1ab5e40822ed53852cbf181cb90c80a68a1d9",
  "result_policy": {
    "fingerprint": "sha256:56f31e83efb5caa3e806b0eba3735009ac1387003fa5888b9a78e774a6218578",
    "rules": {
      "schema_version": 2,
      "expected_model": "example-review-model",
      "max_response_bytes": 256,
      "response_format": "json-object",
      "required_json_keys": [
        "diagnosis",
        "evidence",
        "next_step"
      ],
      "allowed_json_keys": [
        "diagnosis",
        "evidence",
        "next_step"
      ],
      "json_key_types": {
        "diagnosis": "string",
        "evidence": "array",
        "next_step": "string"
      }
    }
  },
  "request": {
    "fingerprint": "sha256:4c04cb6a6352ef10b09403b8f5b7da03e71dbfd278606fc25edb5274c3399d59",
    "messages": 2,
    "context_items": 1,
    "context_bytes": 343,
    "estimated_input_tokens": 315
  },
  "provider": {
    "endpoint": "http://127.0.0.1:11434/v1",
    "requested_model": "example-review-model",
    "response_model": null,
    "timeout_seconds": 45,
    "max_output_tokens": 256
  },
  "budgets": {
    "max_estimated_input_tokens": 5000,
    "remaining_estimated_input_tokens": 4685,
    "reported_completion_tokens": null,
    "remaining_reported_output_tokens": null
  },
  "result": {
    "response": {
      "chars": 100,
      "bytes": 100,
      "sha256": "sha256:d10517f83c16d86209750ef9c9101cf06770a9df1b8f7a8386293921f7c3f7e5"
    },
    "response_structure": {
      "format": "json-object",
      "top_level_keys": 3
    },
    "usage": {
      "prompt_tokens": null,
      "completion_tokens": null,
      "total_tokens": null
    }
  }
}
